"conversation_id_str","created_at","favorite_count","full_text","id_str","image_url","in_reply_to_screen_name","lang","location","quote_count","reply_count","retweet_count","tweet_url","user_id_str","username"
"1785924432432971910","Thu May 02 06:49:00 +0000 2024","73","Kalo kaya gini bacanya apa? Tahu Bakso atau Tahu Banyao? https://t.co/kwwft5noB1","1785924432432971910","https://pbs.twimg.com/media/Dw8RcXVVAAADqdt.jpg","","in","Nusantara","0","0","22","https://twitter.com/MasakTV/status/1785924432432971910","120074934","MasakTV"
"1785979115662975349","Thu May 02 10:26:17 +0000 2024","7","kalian tau gak perbedaan kalian ama bakso kalau bakso dikasih kuah kalau kaliah dikasih muach muach #JimmySeaXMintTalk https://t.co/uSqfxlnQty","1785979115662975349","https://pbs.twimg.com/media/GMkSiGja4AAPGa3.jpg","","in","","0","2","1","https://twitter.com/cemysea/status/1785979115662975349","1719556419417264128","cemysea"
"1786989275546001586","Sun May 05 05:20:18 +0000 2024","0","Kuduna bieu bakso malangna jeung sangu ameh wareug https://t.co/WyJVgVhiFZ","1786989275546001586","https://pbs.twimg.com/media/GMypRjlbIAA8-L8.jpg","","in","Bandung Jawa Barat Indonesia","0","0","0","https://twitter.com/YoshitakaFitrot/status/1786989275546001586","601508815","YoshitakaFitrot"
"1784061576070451439","Sat Apr 27 03:26:40 +0000 2024","4","Kenapa yg trix nya doang gaada yak? https://t.co/WRDhmJKiBW","1784061576070451439","https://pbs.twimg.com/media/GMJCjH6bEAAxJPu.jpg","","in","","0","0","0","https://twitter.com/Baksobison/status/1784061576070451439","1492846450761367555","Baksobison"
"1786722346596012439","Sat May 04 11:39:37 +0000 2024","4","Hallo from my Mie Ayam Bakso ( it's noodles family I think ) !! Bon appetit https://t.co/ExdrqpZYyb","1786722346596012439","https://pbs.twimg.com/media/GMu2A9PacAAMxdE.jpg","","en","DJB-PEK-KOR","0","1","0","https://twitter.com/Dear6__/status/1786722346596012439","3230473074","Dear6__"
"1784427625274024207","Sun Apr 28 03:43:25 +0000 2024","9","Ada yang tau bakso apa ini? https://t.co/cIhAk1F9uT","1784428180482515101","https://pbs.twimg.com/ext_tw_video_thumb/1784428148618321920/pu/img/sEyBO_VGemVpGxRx.jpg","everynays","in","she/her","0","1","1","https://twitter.com/everynays/status/1784428180482515101","1426055988537225225","everynays"
"1784049984805204082","Sat Apr 27 02:40:37 +0000 2024","2","Banyak variasi mie di Bandung. Bakmie yamin manis yamis asin mie bakso mie glosor... hmm apa lagi nih wargi? foto: Mie Jakarta di Ciumbuleuit https://t.co/7lUwNxkeAz","1784049984805204082","https://pbs.twimg.com/media/GMIxQ-NbgAAZ9rU.jpg","","in","Bandung, West Java, Indonesia","0","4","0","https://twitter.com/PRFMnews/status/1784049984805204082","150589950","PRFMnews"
"1784181653583368443","Sat Apr 27 11:23:49 +0000 2024","4","nyatet tubuh kata trus nonton sambil makan bakso https://t.co/zk4bjj3wrc","1784181653583368443","https://pbs.twimg.com/media/GMKvvTZaUAAkSNh.jpg","","in","","0","2","0","https://twitter.com/shaeaiueoo/status/1784181653583368443","1778994492814786561","shaeaiueoo"
"1785865913281253741","Thu May 02 02:56:28 +0000 2024","0","@1 ini enaknya aku saranin dia seblak atau bakso aci aja yang enak https://t.co/NVFZnEXs5M","1785865913281253741","https://pbs.twimg.com/media/GMirlGMb0AARqah.jpg","1","in","CHIPERS🪭;🏡 ASTRON on Venus","0","0","0","https://twitter.com/AST98LUSI/status/1785865913281253741","1484754323473321985","AST98LUSI"
"1784217493609087104","Sat Apr 27 13:46:14 +0000 2024","0","mau makan mie aja dah gw. enakan indomie apa mie sedap ya bingungggg. pengen indomie ayam spesial tp pnge mie sedap soto/bakso. ke warung dulu deh. eh sorry pict dibawah anggep gaada aja. biarin pokoknya biarin aja https://t.co/T9W2DTIfi6","1784217493609087104","https://pbs.twimg.com/media/GMLQWebagAAGzVj.jpg","","in","","0","0","0","https://twitter.com/gyuldaegyu/status/1784217493609087104","1541340740961202176","gyuldaegyu"
"1787139666975801637","Sun May 05 15:17:54 +0000 2024","0","bakso yang bentuk nya kaya est ada gak ya","1787139666975801637","","","in","","0","1","0","https://twitter.com/nnaatnnatt/status/1787139666975801637","1565697401314508801","nnaatnnatt"
"1787101518241599555","Sun May 05 12:46:19 +0000 2024","0","Umr solo 2 2 juta Kalo setiap ke suatu tempat ada tukang parkir dan harus bayar minimal 2000 maka 3% dari gaji orang solo sudah hilang tiap bulanya Itu kalau sehari kena parkir 2000 dan cuma 1x Kalau sehari kena 5x Hmmm Jadi apa benar bayar 2000 gak bikin miskin ??","1787101518241599555","","","in","","1","0","0","https://twitter.com/VideograferNewb/status/1787101518241599555","1433820142081769474","VideograferNewb"
"1787108105387659745","Sun May 05 13:12:29 +0000 2024","0","Gw baru baca komen postingan ini .. tapi kok ya banyak yang nyinyir ya Yang cewek 19 yang cowok 60 tahun Kan mereka di usia yang sudah dewasa dan punya kebebasan untuk memilih mau gimana Toh batas minimal usia menikah untuk wanita 19 tahun .. jadi biasa aja lah","1787108105387659745","","","in","","0","0","0","https://twitter.com/VideograferNewb/status/1787108105387659745","1433820142081769474","VideograferNewb"
"1784928064063054232","Mon Apr 29 12:49:47 +0000 2024","10","Makan bakso yg pedes enak kali yah ","1784928064063054232","","","in","Nusantara Pertiwi","0","3","0","https://twitter.com/Rosses1Black/status/1784928064063054232","892290867582468097","Rosses1Black"
"1785554497869381795","Wed May 01 06:19:00 +0000 2024","0","baru bangun mencium wangi bakso di sekitar rumah ku keluargaku ngebakso ga ngajak ngajak","1785554497869381795","","","in","24+ ; shappic!","0","0","0","https://twitter.com/kzh4aa/status/1785554497869381795","1712510732670218241","kzh4aa"
"1785195436690870429","Tue Apr 30 06:32:14 +0000 2024","0","Knp klo makan mie ayam sambel 3 sendok aja tih pedes nya uda berasa tapi klo makan bakso 5 sendok gg kerasa pedes ","1785195436690870429","","","in","Bogor, Jawa Barat","0","0","0","https://twitter.com/CallMeOneng__/status/1785195436690870429","1356128153022816257","CallMeOneng__"
"1784248592573816969","Sat Apr 27 15:52:11 +0000 2024","0","@Ummuabdillah09 Bakso urat? ","1784249192380334225","","Ummuabdillah09","in","Jakarta Pusat, DKI Jakarta","0","0","0","https://twitter.com/suryakuyem/status/1784249192380334225","1334944851834535937","suryakuyem"
"1784240828493521313","Sat Apr 27 15:38:20 +0000 2024","0","@chimeoww Itu garisnya mepet ke bakso lapangan tembak","1784245704367763895","","chimeoww","in","nomad homeless","0","2","0","https://twitter.com/less__rice/status/1784245704367763895","1311978199803289600","less__rice"
"1787003840933605812","Sun May 05 06:43:46 +0000 2024","1","@jentiendrati macam bakso tapi bukan bakso","1787010278800167421","","jentiendrati","in","","0","1","0","https://twitter.com/faulmiese/status/1787010278800167421","1728225340286464000","faulmiese"
"1784847906476052906","Mon Apr 29 07:32:52 +0000 2024","0","Eh gwe mam bakso sebelum msup ape sesudah ye","1784848307493441648","","talkabtwayv","in","kun&tenfav`","0","0","0","https://twitter.com/talkabtwayv/status/1784848307493441648","601784038","talkabtwayv"
